{
  "format": "lineart.scene/1",
  "name": "polymerase",
  "canvas": {
    "width": 90,
    "height": 90,
    "unit": "mm",
    "background": "none"
  },
  "frames": {
    "art": {
      "unit": "px",
      "parent": "page",
      "transform": [0.07177, 0, 0, 0.07177, 0, 0]
    },
    "page": {
      "unit": "mm"
    }
  },
  "elements": [
    {
      "name": "art",
      "type": "group",
      "frame": "art",
      "provenance": {
        "origin": "trace",
        "source": "tests/fixtures/polymerase.png",
        "sha256": "b6416ece35fdf4dfa338cf5bd0c3334a0d12ea358edfa0c5716ca29be1bebc0e",
        "tool": "lineart.trace",
        "tool_version": "0.2.0",
        "params": {
          "close": 0,
          "colors": 1,
          "corner_angle": 75,
          "denoise": false,
          "despeckle": 0,
          "error": 1,
          "fill_ratio": 3,
          "max_colors": 8,
          "method": "auto",
          "min_fill_area": 16,
          "prune": 0,
          "smooth": 5,
          "thin_limit": 0.32,
          "thresh": 200
        }
      },
      "children": [
        {
          "name": "ink",
          "type": "group",
          "children": [
            {
              "name": "stroke-001",
              "style": {
                "stroke": "#111111",
                "stroke_width": 5,
                "stroke_cap": "round",
                "stroke_join": "round",
                "fill": "none"
              },
              "type": "path",
              "geometry": {
                "kind": "path",
                "closed": true,
                "d": [
                  ["M", 621, 71],
                  ["C", 639.022212, 66.494447, 649.042462, 86.029723, 661, 94.4],
                  ["C", 677.928277, 106.249794, 701.14326, 104.000282, 718, 115.8],
                  ["C", 734.461935, 127.323354, 731.636412, 148.945488, 748, 160.4],
                  ["C", 753.94297, 164.560079, 760.76623, 165.083115, 767, 168.2],
                  ["C", 778.270497, 173.835248, 785.029141, 183.397086, 799, 182],
                  ["C", 819.448566, 179.955143, 825.055086, 158.816526, 851, 166.6],
                  ["C", 872.327538, 172.998262, 867.654858, 195.327429, 885, 204],
                  ["C", 894.258999, 208.629499, 903.443861, 206.733158, 913, 209.6],
                  ["C", 933.775911, 215.832773, 939.890557, 240.094425, 938, 259],
                  ["C", 935.000618, 288.993818, 903.149249, 287.835835, 897.4, 307],
                  ["C", 895.309811, 313.967298, 890.464626, 323.646259, 891.2, 331],
                  ["C", 892.580252, 344.802522, 899.669897, 349.301029, 898, 366],
                  ["C", 896.838188, 377.618123, 886.494602, 383.68466, 883.4, 394],
                  ["C", 881.427538, 400.574872, 883.514206, 407.619312, 881.6, 414],
                  ["C", 878.782454, 423.39182, 870.314797, 427.770406, 866.2, 436],
                  ["C", 862.47458, 443.45084, 864.090581, 451.818838, 860, 460],
                  ["C", 855.833473, 468.333054, 847.032761, 471.296933, 841, 478],
                  ["C", 835.658193, 483.935341, 836.0726, 492.64918, 829, 497.6],
                  ["C", 809.38194, 511.332642, 796.431528, 496.770542, 777, 502.6],
                  ["C", 757.884312, 508.334706, 757.356543, 525.493037, 741, 530.4],
                  ["C", 726.836854, 534.648944, 712.348948, 526.295316, 698, 530.6],
                  ["C", 680.64375, 535.806875, 681.878123, 544.662112, 671.8, 556],
                  ["C", 668.841853, 559.327916, 664.386062, 560.49115, 661, 563.2],
                  ["C", 648.26401, 573.388792, 640.335755, 589.357549, 642, 606],
                  ["C", 643.456728, 620.567285, 650.238928, 632.315035, 661, 642],
                  ["C", 663.817301, 644.535571, 667.320954, 646.320954, 670, 649],
                  ["C", 677.297656, 656.297656, 682.853886, 661.156166, 693, 664.2],
                  ["C", 702.140727, 666.942218, 715.211951, 662.921195, 726, 664],
                  ["C", 746.161974, 666.016197, 750.146297, 686.38537, 774, 684],
                  ["C", 788.721405, 682.527859, 793.539331, 666.046067, 814, 664],
                  ["C", 830.216588, 662.378341, 839.747994, 676.124398, 854, 680.4],
                  ["C", 862.644491, 682.993347, 871.235054, 681.876495, 880, 681],
                  ["C", 893.044534, 679.695547, 923.871068, 683.856742, 933, 694],
                  ["C", 945.814372, 708.238192, 945.141319, 729.891016, 932.6, 744],
                  ["C", 928.321043, 748.813826, 922.239252, 751.515355, 918.4, 757],
                  ["C", 912.33868, 765.659029, 915.26299, 776.456699, 912.4, 786],
                  ["C", 908.614992, 798.616693, 897.366484, 806.66484, 898.8, 821],
                  ["C", 900.653332, 839.533317, 920.131628, 847.683719, 918, 869],
                  ["C", 917.143255, 877.567447, 913.853092, 887.496564, 908, 894],
                  ["C", 904.210558, 898.210491, 900.29295, 901.356833, 898.6, 907],
                  ["C", 894.942537, 919.191542, 900.020713, 926.735708, 903.4, 938],
                  ["C", 905.006036, 943.353454, 904.555568, 951.444321, 904, 957],
                  ["C", 902.580441, 971.195586, 887.422119, 978.778812, 886, 993],
                  ["C", 883.655042, 1016.449584, 901.532563, 1023.534874, 888.8, 1049],
                  ["C", 881.88831, 1062.823379, 867.609322, 1060.912543, 857, 1069.4],
                  ["C", 846.922167, 1077.462266, 847.864185, 1091.135815, 839, 1100],
                  ["C", 832.111839, 1106.888161, 821.913441, 1107.086559, 815, 1114],
                  ["C", 798.683765, 1130.316235, 810.44371, 1149.078145, 783, 1162.8],
                  ["C", 742.844797, 1182.877602, 730.453823, 1141.163853, 699, 1150.6],
                  ["C", 672.939461, 1158.418162, 676.011882, 1186.498812, 641, 1190],
                  ["C", 619.45961, 1192.154039, 592.296417, 1175.964167, 590, 1153],
                  ["C", 588.855977, 1141.559772, 593.440063, 1129.880126, 588, 1119],
                  ["C", 580.436049, 1103.872098, 565.996961, 1102.96961, 564, 1083],
                  ["C", 562.40736, 1067.073603, 577.813547, 1058.135469, 576, 1040],
                  ["C", 574.719309, 1027.193087, 562.265595, 1021.655954, 560.6, 1005],
                  ["C", 559.355791, 992.557912, 565.711718, 988.976564, 570.2, 980],
                  ["C", 578.171258, 964.057484, 576.556463, 945.489524, 561, 934.6],
                  ["C", 552.247222, 928.473056, 541.616832, 930.28505, 532, 927.4],
                  ["C", 519.499778, 923.649933, 512.485062, 912.348506, 499, 911],
                  ["C", 482.648794, 909.364879, 474.515732, 923.057866, 456, 913.8],
                  ["C", 444.532595, 908.066297, 442.218557, 895.55299, 432, 888.4],
                  ["C", 421.422774, 880.995942, 407.347309, 886.312578, 397, 877],
                  ["C", 384.606439, 865.845795, 388.627288, 850.488187, 369, 844.6],
                  ["C", 356.703478, 840.911043, 345.549827, 848.254983, 333, 847],
                  ["C", 325.959113, 846.295911, 320.361068, 841, 313, 841],
                  ["C", 306.846967, 841, 301.63356, 844.709932, 296, 846.4],
                  ["C", 279.171784, 851.448465, 264.345831, 844.606479, 253, 832],
                  ["C", 238.505755, 815.895283, 249.760594, 800.605939, 248, 783],
                  ["C", 246.845339, 771.453387, 234.056855, 765.856183, 230.8, 755],
                  ["C", 226.807503, 741.691675, 235.412993, 728.376645, 231.4, 715],
                  ["C", 223.468155, 688.560515, 191.772777, 699.272234, 196, 657],
                  ["C", 196.591157, 651.088434, 199.859103, 645.140897, 204, 641],
                  ["C", 221.028152, 623.971848, 228.974424, 632.978289, 242, 621.4],
                  ["C", 256.164296, 608.809515, 247.70376, 592.19248, 254.8, 578],
                  ["C", 262.025361, 563.549278, 279.964051, 562.359489, 282, 542],
                  ["C", 283.994547, 522.054532, 267.820308, 513.203084, 266, 495],
                  ["C", 264.649549, 481.495489, 275.358867, 469.196224, 271.4, 456],
                  ["C", 265.451125, 436.170416, 244.754826, 435.483912, 253.6, 406],
                  ["C", 260.757675, 382.141082, 285.545859, 390.756901, 295.6, 374],
                  ["C", 305.791996, 357.013339, 295.137603, 340.431198, 320, 328],
                  ["C", 337.762527, 319.118737, 361.536865, 323.052664, 373.4, 340],
                  ["C", 383.562352, 354.517646, 378.128617, 367.864309, 398, 377.8],
                  ["C", 412.469201, 385.0346, 430.022935, 382.483945, 443, 373.4],
                  ["C", 452.831631, 366.517858, 457.803776, 354.680378, 473, 356.2],
                  ["C", 482.504042, 357.150404, 493.681349, 361.962698, 498.2, 371],
                  ["C", 500.512815, 375.62563, 501.381898, 379.979887, 505, 384],
                  ["C", 519.586268, 400.206964, 545.819373, 401.18278, 562, 386.8],
                  ["C", 569.538634, 380.098992, 568.908012, 371.183976, 573, 363],
                  ["C", 579.608536, 349.782929, 592.953711, 348.537108, 591, 329],
                  ["C", 589.838258, 317.382582, 580.741303, 310.413034, 579.4, 297],
                  ["C", 578.094464, 283.944641, 588.66504, 273.2168, 584.4, 259],
                  ["C", 579.775182, 243.583941, 565.206591, 243.065905, 563, 221],
                  ["C", 561.953232, 210.532322, 570.618218, 202.272606, 573.4, 193],
                  ["C", 577.068801, 180.770662, 572.743312, 168.18896, 576.4, 156],
                  ["C", 579.356554, 146.144819, 589.291334, 141.017333, 593.8, 132],
                  ["C", 602.03025, 115.539499, 587.341034, 99.323707, 600.4, 83],
                  ["C", 605.776407, 76.279491, 612.907389, 73.023153, 621, 71],
                  ["Z"]
                ]
              }
            }
          ]
        }
      ]
    }
  ]
}
